359;REFRIGERANTE DORE GUARANA GARRAFA PET 250ML;UN;1,14;27/12/2019;3
360;REFRIGERANTE DORE COLA GARRAFA PET 250ML;UN;1,14;27/12/2019;3
361;REFRIGERANTE DORE LARANJA GARRAFA PET 250ML;UN;1,14;27/12/2019;3
362;REFRIGERANTE DORE LIMAO GARRAFA PET 250ML;UN;1,14;27/12/2019;3
363;REFRIGERANTE DORE UVA GARRAFA PET 250ML;UN;1,14;27/12/2019;3
364;REFRIGERANTE GRAPETTE GARRAFA PET 250ML;UN;1,29;27/12/2019;3
365;REFRIGERANTE GRAPETTE UVA VERDE GARRAFA PET 250ML;UN;1,29;27/12/2019;3
366;REFRIGERANTE RC COLA GARRAFA PET 250ML;UN;1,14;27/12/2019;3
367;REFRIGERANTE ICE COLA GARRAFA PET 250ML;UN;1,14;27/12/2019;3
368;REFRIGERANTE GRAPETTE GARRAFA PET 290ML;UN;1,5;27/12/2019;3
369;REFRIGERANTE DORE GUARANA GARRAFA PET 1L;UN;3;27/12/2019;3
370;REFRIGERANTE DORE LARANJA GARRAFA PET 1L;UN;3;27/12/2019;3
371;REFRIGERANTE GRAPETTE GARRAFA PET 1L;UN;3;27/12/2019;3
372;REFRIGERANTE RC COLA GARRAFA PET 1L;UN;3;27/12/2019;3
373;REFRIGERANTE ICE COLA GARRAFA PET 1L;UN;3;27/12/2019;3
374;REFRIGERANTE DORE GUARANA GARRAFA PET 2L;UN;4,21;27/12/2019;3
375;REFRIGERANTE DORE COLA GARRAFA PET 2L;UN;4,21;27/12/2019;3
376;REFRIGERANTE DORE LARANJA GARRAFA PET 2L;UN;4,21;27/12/2019;3
377;REFRIGERANTE DORE LIMAO GARRAFA PET 2L;UN;4,21;27/12/2019;3
378;REFRIGERANTE DORE UVA GARRAFA PET 2L;UN;4,21;27/12/2019;3
379;REFRIGERANTE ICE COLA GARRAFA PET 2L;UN;4,5;27/12/2019;3
96;ENERGÉTICO BALY FRUTAS TROPICAIS GARRAFA PET 1L;UN;5,42;27/12/2019;5
97;ENERGÉTICO BALY FRUTAS TROPICAIS GARRAFA PET 2L;UN;7,9;27/12/2019;5
98;ENERGÉTICO BALY FRUTAS TROPICAIS LATA 250ML;UN;3,8;27/12/2019;5
99;ENERGÉTICO BALY CRANBERRY LATA 250ML;UN;3,8;27/12/2019;5
100;ENERGÉTICO BALY LABELLAMAFIA LATA 250ML;UN;3,8;27/12/2019;5
101;ENERGÉTICO MORMAII GARRAFA PET 269ml;UN;2,99;27/12/2019;5
102;ENERGÉTICO MORMAII GARRAFA PET 1L;UN;7,9;27/12/2019;5
103;ENERGÉTICO MORMAII GARRAFA PET 2L;UN;11,32;27/12/2019;5
104;ENERGÉTICO INIFINITY GARRAFA PET 1L;UN;6,26;27/12/2019;5
238;CACHACA SÃO PAULO CRISTAL GARRAFA 355ML;UN;5,74;27/12/2019;6
239;CACHACA SÃO PAULO CAIPIRA MINI GARRAFA 275ML;UN;4,55;27/12/2019;6
240;CACHACA SÃO PAULO GARRAFA 1L;UN;12,18;27/12/2019;6
241;CACHACA SÃO PAULO UMBURANA GARRAFA 500ML;UN;12,88;27/12/2019;6
242;CACHACA SÃO PAULO CAIPIRA GARRAFA 1L;UN;10,52;27/12/2019;6
243;CACHACA SÃO PAULO CAIPIRA UMBURANA GARRAFA 275ML;UN;8,24;27/12/2019;6
244;CACHACA SÃO PAULO CAIPIRA UMBURANA GARRAFA 1L;UN;14,47;27/12/2019;6
275;VODKA INTENCION 50 DOUBLE BLACK GARRAFA 900ML;UN;14,9;27/12/2019;8
276;VODKA SMIRNOFF ICE REGULAR LATA 269ML;UN;4,5;27/12/2019;8
390;BEBIDA ALCOÓLICA MISTA FLY ONE LIMAO COM GENGIBRE GARRAFA 275ML;UN;3,53;27/12/2019;11
391;BEBIDA ALCOÓLICA MISTA FLY ONE ABACAXI COM HORTELA GARRAFA 275ML;UN;3,53;27/12/2019;11
392;BEBIDA ALCOÓLICA MISTA FLY ONE MARACUJA GARRAFA 275ML;UN;3,53;27/12/2019;11
393;"BEBIDA ALCOÓLICA MISTA FLY ONE TANGERINA COM PIMENTA GARRAFA
275ML";UN;3,53;27/12/2019;11
394;BEBIDA ALCOÓLICA MISTA FLY ONE GRAPEFRUIT GARRAFA 275ML;UN;3,53;27/12/2019;11
395;BEBIDA ALCOÓLICA MISTA FLY ONE FRUTAS VERMELHAS GARRAFA 275ML;UN;3,53;27/12/2019;11
396;APERITIVO DE AGAVE ARRIBA MEXICALE GARRAFA 900ML;UN;15;27/12/2019;11
397;GIM STRAWBERRY INTENCION GARRAFA 900ml;UN;12,5;27/12/2019;11
398;RUM INTECION BLANCO GARRAFA 900ML;UN;14,9;27/12/2019;11
399;FILTRADO BRANCO DEL SOLE GARRAFA 660ML;UN;13,32;27/12/2019;11
400;FILTRADO ROSE DEL SOLE GARRAFA 660ML;UN;13,32;27/12/2019;11
401;GIN GORDON S DRY GARRAFA 750ML;UN;64,9;27/12/2019;11
402;GIN TANQUERAY LONDON DRY GARRAFA 750ML;UN;112,23;27/12/2019;11
54;WHISKY OLD PARR AGED 12 ANOS GARRAFA 750ML;UN;106,28;27/12/2019;13
55;WHISKY BUCHANANS DELUXE AGED 12 ANOS GARRAFA 1L;UN;158,09;27/12/2019;13
340;ESPUMANTE ALIANCA MOSCATEL ASTI GARRAFA 750ML;UN;37,07;27/12/2019;14
341;ESPUMANTE ROSE ALIANCA BRUT GARRAFA 750ML;UN;37,7;27/12/2019;14
342;ESPUMANTE SANTA COLINA BRUT GARRAFA 750ML;UN;29,34;27/12/2019;14
343;ESPUMANTE SANTA COLINA DEMI SEC GARRAFA 750ML;UN;29,34;27/12/2019;14
344;ESPUMANTE SANTA COLINA MOSCATEL GARRAFA 750ML;UN;29,34;27/12/2019;14
345;ESPUMANTE ALIANCA BRUT GARRAFA 750ML;UN;37,07;27/12/2019;14
3003;VINHO TINTO COLLINA SUAVE GARRAFA 750ML;UN;10,04;27/12/2019;15
3304;VINHO TINTO COLLINA SECO GARRAFA 750ML;UN;10,04;27/12/2019;15
3005;VINHO BRANCO COLLINA SECO GARRAFA 750ML;UN;10,04;27/12/2019;15
3006;VINHO BRANCO COLLINA SUAVE GARRAFA 750ML;UN;10,04;27/12/2019;15
3007;VINHO TINTO COLLINA DEMI SEC GARRAFA 750ML;UN;10,04;27/12/2019;15
3008;VINHO TINTO SANTA COLINA CABERNET SAUVIGNON SECO GARRAFA 750ML;UN;18,92;27/12/2019;15
3009;"VINHO TINTO SANTA COLINA CABERNET SAUVIGNON DEMI SEC GARRAFA
750ML";UN;18,92;27/12/2019;15
3010;VINHO TINTO SANTA COLINA MERLOT SECO GARRAFA 750ML;UN;18,92;27/12/2019;15
3011;VINHO TINTO SANTA COLINA TANNAT SECO GARRAFA 750ML;UN;18,92;27/12/2019;15
3012;VINHO TINTO SANTA COLINA PINOT NOIR SECO GARRAFA 750ML;UN;18,92;27/12/2019;15
3013;VINHO BRANCO SANTA COLINA CHARDONNAY SECO GARRAFA 750ML;UN;18,92;27/12/2019;15
3014;VINHO TINTO SANTA COLINA CABERNET SAUVIGNON SECO BAG IN BOX 3L;UN;69,5;27/12/2019;15
3015;VINHO TINTO SANTA COLINA CABERNET MERLOT BAG IN BOX 3L;UN;69,5;27/12/2019;15
3016;"VINHO TINTO SANTA COLINA ESTILO CABERNET SAUVIGNON SECO GARRAFA
750ML";UN;22,39;27/12/2019;15
3017;VINHO TINTO SANTA COLINA ESTILO MERLOT SECO GARRAFA 750ML;UN;22,39;27/12/2019;15
3018;VINHO TINTO SANTA COLINA ESTILO TANNAT SECO GARRAFA 750ML;UN;22,39;27/12/2019;15
3019;VINHO BRANCO SANTA COLINA ESTILO CHARDONNAY SECO GARRAFA 750ML;UN;22,39;27/12/2019;15
3020;VINHO BRANCO REDENTOR SECO GARRAFA PET 1,48L;UN;13;27/12/2019;15
3021;VINHO TINTO REDENTOR SUAVE GARRAFA PET 1,48L;UN;13;27/12/2019;15
3022;VINHO TINTO REDENTOR SECO GARRAFA PET 1,48L;UN;13;27/12/2019;15
3023;"VINHO TINTO SANTA COLINA CABERNET SAUVIGNON SUAVE GARRAFA
750ML";UN;19;27/12/2019;15
3024;VINHO TINTO CERRO DA CRUZ CHARDONNAY GARRAFA 750ML;UN;81,08;27/12/2019;15
3025;VINHO TINTO CERRO DA CRUZ TANNAT GARRAFA 750ML;UN;81,08;27/12/2019;15
3026;VINHO TINTO CERRO DA CRUZ ASSEMBLAGE GARRAFA 750ML;UN;81,08;27/12/2019;15
3027;VINHO TINTO SÃO VICTOR BORDO DE MESA SUAVE GARRAFA 1L;UN;18,15;27/12/2019;15
3028;VINHO TINTO SÃO VICTOR BORDO DE MESA SECO GARRAFA 1L;UN;18,15;27/12/2019;15
3029;VINHO BRANCO SÃO VICTOR MOSCATO DE MESA SECO GARRAFA 1L;UN;18,15;27/12/2019;15
3030;VINHO TINTO SÃO VICTOR BORDO DE MESA SUAVE BAG IN BOX 3L;UN;48,07;27/12/2019;15
3031;VINHO TINTO SÃO VICTOR BORDO DE MESA SECO BAG IN BOX 3L;UN;48,07;27/12/2019;15
3032;VINHO BRANCO SÃO VICTOR MOSCATO DE MESA SECO BAG IN BOX 3L;UN;48,07;27/12/2019;15
